{
  "schema_version": "target-vacancy-research-v1",
  "research_kind": "sre_platform_devops_current_vacancies",
  "locale": "en",
  "as_of_date": "2026-08-13",
  "search_scope": {"geography_scope": "mexico_or_stated_remote", "target_role_families": ["site_reliability_engineering", "platform_engineering", "devops_engineering"], "maximum_vacancies": 5, "distinct_employers_preferred": true, "official_sources_first": true, "linkedin_jobs_backup_allowed": true, "no_eligibility_inference": true},
  "state": "limited_market_evidence",
  "search_limit": {"bounded_queries_run": 12, "limit_reason": "source_limit", "distinct_employer_search_exhausted": false, "limitation": "Only four active postings met the bounded source scope."},
  "employers": [
    {"employer_id": "EMP-001", "display_name": "Fixture Employer A", "qualification_type": "official_headcount", "qualification_observation": "Public employer evidence was observed in the bounded search.", "official_source_title": "Fixture employer profile A", "official_source_url": "https://example.com/employers/a", "source_date": "2026-08-12", "access_date": "2026-08-13"},
    {"employer_id": "EMP-002", "display_name": "Fixture Employer B", "qualification_type": "official_headcount", "qualification_observation": "Public employer evidence was observed in the bounded search.", "official_source_title": "Fixture employer profile B", "official_source_url": "https://example.com/employers/b", "source_date": "2026-08-12", "access_date": "2026-08-13"},
    {"employer_id": "EMP-003", "display_name": "Fixture Employer C", "qualification_type": "official_headcount", "qualification_observation": "Public employer evidence was observed in the bounded search.", "official_source_title": "Fixture employer profile C", "official_source_url": "https://example.com/employers/c", "source_date": "2026-08-12", "access_date": "2026-08-13"},
    {"employer_id": "EMP-004", "display_name": "Fixture Employer D", "qualification_type": "official_headcount", "qualification_observation": "Public employer evidence was observed in the bounded search.", "official_source_title": "Fixture employer profile D", "official_source_url": "https://example.com/employers/d", "source_date": "2026-08-12", "access_date": "2026-08-13"}
  ],
  "vacancies": [
    {"vacancy_id": "V-001", "duplicate_fingerprint": "fixture-v-001-en", "employer_id": "EMP-001", "title": "Site Reliability Engineer", "role_family": "site_reliability_engineering", "location": "Remote from Mexico", "arrangement": "remote", "geographic_compatibility": "stated_remote_unknown_eligibility", "source_kind": "official_employer", "source_url": "https://example.com/careers/en-v-001", "official_referrer_url": null, "source_state": "active", "access_date": "2026-08-13", "publication_date": "2026-08-10", "freshness_status": "current", "eligibility_gates": [{"gate": "country_geography", "state": "unknown", "observed_condition": "Remote scope is stated; country eligibility is not specified."}], "requirements": [{"requirement_id": "V-001-R-01", "signal": "kubernetes", "importance": "must_have", "source_paraphrase": "Kubernetes operations are described."}, {"requirement_id": "V-001-R-02", "signal": "terraform", "importance": "preferred", "source_paraphrase": "Terraform experience is described."}]},
    {"vacancy_id": "V-002", "duplicate_fingerprint": "fixture-v-002-en", "employer_id": "EMP-002", "title": "Platform Engineer", "role_family": "platform_engineering", "location": "Mexico", "arrangement": "hybrid", "geographic_compatibility": "explicit_mexico", "source_kind": "official_employer", "source_url": "https://example.com/careers/en-v-002", "official_referrer_url": null, "source_state": "active", "access_date": "2026-08-13", "publication_date": "2026-08-10", "freshness_status": "current", "eligibility_gates": [{"gate": "country_geography", "state": "pass", "observed_condition": "The posting names Mexico."}], "requirements": [{"requirement_id": "V-002-R-01", "signal": "aws", "importance": "must_have", "source_paraphrase": "AWS operations are described."}, {"requirement_id": "V-002-R-02", "signal": "python", "importance": "preferred", "source_paraphrase": "Python automation is described."}]},
    {"vacancy_id": "V-003", "duplicate_fingerprint": "fixture-v-003-en", "employer_id": "EMP-003", "title": "DevOps Engineer", "role_family": "devops_engineering", "location": "Mexico", "arrangement": "hybrid", "geographic_compatibility": "explicit_mexico", "source_kind": "official_employer", "source_url": "https://example.com/careers/en-v-003", "official_referrer_url": null, "source_state": "active", "access_date": "2026-08-13", "publication_date": "2026-08-09", "freshness_status": "current", "eligibility_gates": [{"gate": "country_geography", "state": "pass", "observed_condition": "The posting names Mexico."}], "requirements": [{"requirement_id": "V-003-R-01", "signal": "docker", "importance": "must_have", "source_paraphrase": "Docker is described."}, {"requirement_id": "V-003-R-02", "signal": "gitlab_ci", "importance": "preferred", "source_paraphrase": "GitLab CI is described."}]},
    {"vacancy_id": "V-004", "duplicate_fingerprint": "fixture-v-004-en", "employer_id": "EMP-004", "title": "Reliability Engineer", "role_family": "site_reliability_engineering", "location": "Mexico", "arrangement": "remote", "geographic_compatibility": "explicit_mexico", "source_kind": "official_employer", "source_url": "https://example.com/careers/en-v-004", "official_referrer_url": null, "source_state": "active", "access_date": "2026-08-13", "publication_date": "2026-08-08", "freshness_status": "current", "eligibility_gates": [{"gate": "country_geography", "state": "pass", "observed_condition": "The posting names Mexico."}], "requirements": [{"requirement_id": "V-004-R-01", "signal": "observability", "importance": "must_have", "source_paraphrase": "Observability ownership is described."}, {"requirement_id": "V-004-R-02", "signal": "incident_response", "importance": "responsibility_only", "source_paraphrase": "Incident response is described."}]}
  ],
  "privacy_boundary": "public_vacancy_sources_and_identity_free_candidate_evidence_only",
  "no_external_action": true
}
